{
  "chunk_id": "chunk-0123456789abcdef",
  "doc_id": "doc-workspace-helpcenter-001",
  "source_id": "doc:workspace:000000000001",
  "section_id": "section-0123456789abcdef",
  "source_fingerprint": "aaaaaaaaaaaaaaaaaaaaaaaaaaaaaaaaaaaaaaaaaaaaaaaaaaaaaaaaaaaaaaaa",
  "chunk_index": 0,
  "section_chunk_index": 0,
  "chunk_strategy_version": "section_aware_v1",
  "parse_strategy_version": "parse_normalize_v1",
  "data_release_id": "week07-dev-local",
  "doc_version": "manifest-workspace-helpcenter-20260331-001",
  "section_path": "Getting Started",
  "section_type": "text",
  "content": "Northstar Workspace helps admins configure identity, access, and recovery workflows.",
  "page_no": null,
  "bbox": null,
  "evidence_anchor_ids": ["anchor-0123456789abcdef"],
  "anchor_count": 1,
  "quality_status": "warn",
  "allowed_for_indexing": true,
  "pii_detected": false,
  "reason_codes": ["fallback_parser_used"]
}
